{
  "schema": "sourcefold.character.v0",
  "id": "digital-nightmares-ru/character/rob-hardy",
  "kind": "character",
  "name": {
    "ru": "Роб Харди",
    "en": null
  },
  "roles": [
    "pregen"
  ],
  "player_chooses": [
    "skills"
  ],
  "occupation": {
    "ru": "плотник",
    "en": null
  },
  "occupation_ref": "coc:occupation:tekhnik-master",
  "age": {
    "raw": "36 лет",
    "value": 36
  },
  "sex": "мужской",
  "axes": {
    "era": [
      "modern"
    ],
    "ruleset": "core"
  },
  "statblock": {
    "averages": false,
    "characteristics": {
      "STR": {
        "raw": "70",
        "value": 70
      },
      "CON": {
        "raw": "65",
        "value": 65
      },
      "SIZ": {
        "raw": "60",
        "value": 60
      },
      "DEX": {
        "raw": "70",
        "value": 70
      },
      "INT": {
        "raw": "60",
        "value": 60
      },
      "APP": {
        "raw": "50",
        "value": 50
      },
      "POW": {
        "raw": "45",
        "value": 45
      },
      "EDU": {
        "raw": "60",
        "value": 60
      }
    },
    "hp": {
      "raw": "12",
      "value": 12
    },
    "mp": {
      "raw": "9",
      "value": 9
    },
    "sanity": {
      "raw": "45",
      "value": 45,
      "max": null
    },
    "luck": {
      "raw": "50",
      "value": 50
    },
    "damage_bonus": {
      "raw": "+1d4",
      "value": "+1d4"
    },
    "build": {
      "raw": "1",
      "value": 1
    },
    "move": {
      "raw": "9",
      "value": 9,
      "modes": [
        {
          "mode": "walk",
          "value": 9
        }
      ]
    },
    "attacks": [
      {
        "name": {
          "ru": "Ближний бой (драка)",
          "en": null
        },
        "kind": "attack",
        "skill": "Ближний бой (драка)",
        "chance": {
          "raw": "60% (30/12)",
          "value": 60,
          "half": 30,
          "fifth": 12
        },
        "damage": {
          "raw": "1d3 + БкУ",
          "dice": "1d3",
          "adds_db": true
        }
      }
    ],
    "dodge": {
      "raw": "35% (17/7)",
      "value": 35,
      "half": 17,
      "fifth": 7
    },
    "skills": [
      {
        "name": "Ближний бой (драка)",
        "skill": "coc:skill:fighting",
        "specialization": "Драка",
        "value": {
          "raw": "60% (30/12)",
          "value": 60,
          "half": 30,
          "fifth": 12
        }
      },
      {
        "name": "Взлом",
        "skill": "coc:skill:locksmith",
        "value": {
          "raw": "20% (10/4)",
          "value": 20,
          "half": 10,
          "fifth": 4
        }
      },
      {
        "name": "Внимание",
        "skill": "coc:skill:spot-hidden",
        "value": {
          "raw": "30% (15/6)",
          "value": 30,
          "half": 15,
          "fifth": 6
        }
      },
      {
        "name": "Вождение автомобиля",
        "skill": "coc:skill:drive-auto",
        "value": {
          "raw": "30% (15/6)",
          "value": 30,
          "half": 15,
          "fifth": 6
        }
      },
      {
        "name": "Естествознание",
        "skill": "coc:skill:natural-world",
        "value": {
          "raw": "30% (15/6)",
          "value": 30,
          "half": 15,
          "fifth": 6
        }
      },
      {
        "name": "Искусство/ремесло (плотничество)",
        "skill": "coc:skill:art-craft",
        "specialization": "Плотничество",
        "value": {
          "raw": "60% (30/12)",
          "value": 60,
          "half": 30,
          "fifth": 12
        }
      },
      {
        "name": "Лазание",
        "skill": "coc:skill:climb",
        "value": {
          "raw": "30% (15/6)",
          "value": 30,
          "half": 15,
          "fifth": 6
        }
      },
      {
        "name": "Метание",
        "skill": "coc:skill:throw",
        "value": {
          "raw": "30% (15/6)",
          "value": 30,
          "half": 15,
          "fifth": 6
        }
      },
      {
        "name": "Механика",
        "skill": "coc:skill:mechanical-repair",
        "value": {
          "raw": "40% (20/8)",
          "value": 40,
          "half": 20,
          "fifth": 8
        }
      },
      {
        "name": "Обаяние",
        "skill": "coc:skill:charm",
        "value": {
          "raw": "30% (15/6)",
          "value": 30,
          "half": 15,
          "fifth": 6
        }
      },
      {
        "name": "Ориентирование",
        "skill": "coc:skill:navigate",
        "value": {
          "raw": "40% (20/8)",
          "value": 40,
          "half": 20,
          "fifth": 8
        }
      },
      {
        "name": "Первая помощь",
        "skill": "coc:skill:first-aid",
        "value": {
          "raw": "30% (15/6)",
          "value": 30,
          "half": 15,
          "fifth": 6
        }
      },
      {
        "name": "Прыжки",
        "skill": "coc:skill:jump",
        "value": {
          "raw": "20% (10/4)",
          "value": 20,
          "half": 10,
          "fifth": 4
        }
      },
      {
        "name": "Психология",
        "skill": "coc:skill:psychology",
        "value": {
          "raw": "20% (10/4)",
          "value": 20,
          "half": 10,
          "fifth": 4
        }
      },
      {
        "name": "Скрытность",
        "skill": "coc:skill:stealth",
        "value": {
          "raw": "30% (15/6)",
          "value": 30,
          "half": 15,
          "fifth": 6
        }
      },
      {
        "name": "Слух",
        "skill": "coc:skill:listen",
        "value": {
          "raw": "30% (15/6)",
          "value": 30,
          "half": 15,
          "fifth": 6
        }
      },
      {
        "name": "Средства",
        "skill": "coc:skill:credit-rating",
        "value": {
          "raw": "25% (12/5)",
          "value": 25,
          "half": 12,
          "fifth": 5
        }
      },
      {
        "name": "Стрельба (винтовка/дробовик)",
        "skill": "coc:skill:firearms",
        "specialization": "Винтовка/дробовик",
        "value": {
          "raw": "35% (17/7)",
          "value": 35,
          "half": 17,
          "fifth": 7
        }
      },
      {
        "name": "Стрельба (пистолет)",
        "skill": "coc:skill:firearms",
        "specialization": "Пистолет",
        "value": {
          "raw": "20% (10/4)",
          "value": 20,
          "half": 10,
          "fifth": 4
        }
      },
      {
        "name": "Убеждение",
        "skill": "coc:skill:persuade",
        "value": {
          "raw": "30% (15/6)",
          "value": 30,
          "half": 15,
          "fifth": 6
        }
      },
      {
        "name": "Чтение следов",
        "skill": "coc:skill:track",
        "value": {
          "raw": "40% (20/8)",
          "value": 40,
          "half": 20,
          "fifth": 8
        }
      },
      {
        "name": "Электрика",
        "skill": "coc:skill:electrical-repair",
        "value": {
          "raw": "30% (15/6)",
          "value": 30,
          "half": 15,
          "fifth": 6
        }
      },
      {
        "name": "Язык (английский)",
        "skill": "coc:skill:language-own",
        "specialization": "английский",
        "value": {
          "raw": "60% (30/12)",
          "value": 60,
          "half": 30,
          "fifth": 12
        }
      }
    ]
  },
  "background": {
    "description": "крепкий, небритый и обросший, в повседневной одежде.",
    "traits": "трудолюбивый и дружелюбный.",
    "ideology": "у каждого свой крест.",
    "significant_people": "Дэн Харди: брат. Взяв его с собой в путешествие, вы сможете приглядывать за ним, чтобы он не вернулся к старым дурным привычкам. Вы надеетесь, что тюрьма послужила ему уроком, который он не захочет повторять. Кажется, он старается быть дружелюбным с Деброй и Эльзой.\nДебра Келли: жена Джареда. Вы не уверены, что она целиком поддерживает план по восстановлению отеля. Между ней и её сестрой Эльзой чувствуется напряжение.\nДжаред Келли: кажется хорошим парнем. Он очень воодушевлён своим проектом, но несколько наивен — он ведь никогда и не видел отеля. Кто знает, на что тот будет похож, но вы не можете не уважать смелость Джареда.\nЭльза Леманн: сестра-близнец Дебры. Она повариха и должна заняться кухней отеля. Судя по тому, что вы пока видели, это упрямая и деловая женщина — неудивительно, что она, видимо, недолюбливает Джареда.\nКристи Джонсон: одна из старых подруг Джареда. Кажется милой. Судя по всему, она инструктор по занятиям спортом на открытом воздухе. В том, как Дебра и Эльза смотрят на неё, когда она заговаривает с Джаредом, чувствуется неприязнь."
  },
  "legend": {
    "ru": "Ваш друг Джаред недавно унаследовал старый отель в Британской Колумбии и планирует вместе с женой Деброй отремонтировать и открыть его. Последнее время дела у вас идут плохо, так что вы предложили свою помощь со стройкой. Остаётся надеяться, что денег хватит, чтобы снова встать (и поставить брата) на ноги.\nВы взяли с собой своего брата Дэна. Дэн постоянно попадал в неприятности и всю жизнь едва сводил концы с концами. Он только что вышел из тюрьмы, так что это станет для него хорошим шансом заняться честным трудом и поправить положение. Вы сказали Джареду, что Дэн — мастер на все руки. Это ложь, но вы уверены, что всё как-нибудь да обойдётся.",
    "en": null
  },
  "sources": [
    {
      "book_id": "digital-nightmares-pregens-ru",
      "physical_page": 6,
      "printed_page": null,
      "method": "book_text",
      "verified": true,
      "note": "сценарий: Глава 1: Адский отель"
    }
  ],
  "quality": {
    "needs_review": false,
    "flags": [],
    "notes": "Бонус: распределите 30 пунктов между любыми навыками на выбор игрока."
  }
}
