{
  "schema": "sourcefold.character.v0",
  "id": "digital-nightmares-ru/character/gus-philips",
  "kind": "character",
  "name": {
    "ru": "Гас Филипс",
    "en": null
  },
  "roles": [
    "pregen"
  ],
  "player_chooses": [
    "skills"
  ],
  "occupation": {
    "ru": "офицер полиции",
    "en": null
  },
  "occupation_ref": "coc:occupation:patrulnyy-politseyskiy",
  "age": {
    "raw": "42 года",
    "value": 42
  },
  "sex": "мужской",
  "axes": {
    "era": [
      "modern"
    ],
    "ruleset": "core"
  },
  "statblock": {
    "averages": false,
    "characteristics": {
      "STR": {
        "raw": "70",
        "value": 70
      },
      "CON": {
        "raw": "60",
        "value": 60
      },
      "SIZ": {
        "raw": "65",
        "value": 65
      },
      "DEX": {
        "raw": "55",
        "value": 55
      },
      "INT": {
        "raw": "70",
        "value": 70
      },
      "APP": {
        "raw": "45",
        "value": 45
      },
      "POW": {
        "raw": "70",
        "value": 70
      },
      "EDU": {
        "raw": "70",
        "value": 70
      }
    },
    "hp": {
      "raw": "12",
      "value": 12
    },
    "mp": {
      "raw": "14",
      "value": 14
    },
    "sanity": {
      "raw": "70",
      "value": 70,
      "max": null
    },
    "luck": {
      "raw": "45",
      "value": 45
    },
    "damage_bonus": {
      "raw": "+1d4",
      "value": "+1d4"
    },
    "build": {
      "raw": "1",
      "value": 1
    },
    "move": {
      "raw": "7",
      "value": 7,
      "modes": [
        {
          "mode": "walk",
          "value": 7
        }
      ]
    },
    "attacks": [
      {
        "name": {
          "ru": "Ближний бой (драка)",
          "en": null
        },
        "kind": "attack",
        "skill": "Ближний бой (драка)",
        "chance": {
          "raw": "45% (22/9)",
          "value": 45,
          "half": 22,
          "fifth": 9
        },
        "damage": {
          "raw": "1d3 + 1d4",
          "dice": "1d3",
          "adds_db": true
        },
        "weapon": "coc:weapon:unarmed"
      },
      {
        "name": {
          "ru": "Стрельба (автоматический пистолет 38-го калибра)",
          "en": null
        },
        "kind": "attack",
        "skill": "Стрельба (пистолет)",
        "chance": {
          "raw": "50% (25/10)",
          "value": 50,
          "half": 25,
          "fifth": 10
        },
        "damage": {
          "raw": "1d10",
          "dice": "1d10",
          "adds_db": false
        },
        "weapon": "coc:weapon:38-automatic"
      }
    ],
    "dodge": {
      "raw": "35% (17/7)",
      "value": 35,
      "half": 17,
      "fifth": 7
    },
    "skills": [
      {
        "name": "Ближний бой (драка)",
        "skill": "coc:skill:fighting",
        "specialization": "Драка",
        "value": {
          "raw": "45% (22/9)",
          "value": 45,
          "half": 22,
          "fifth": 9
        }
      },
      {
        "name": "Внимание",
        "skill": "coc:skill:spot-hidden",
        "value": {
          "raw": "30% (15/6)",
          "value": 30,
          "half": 15,
          "fifth": 6
        }
      },
      {
        "name": "Вождение автомобиля",
        "skill": "coc:skill:drive-auto",
        "value": {
          "raw": "50% (25/10)",
          "value": 50,
          "half": 25,
          "fifth": 10
        }
      },
      {
        "name": "Запугивание",
        "skill": "coc:skill:intimidate",
        "value": {
          "raw": "45% (22/9)",
          "value": 45,
          "half": 22,
          "fifth": 9
        }
      },
      {
        "name": "Красноречие",
        "skill": "coc:skill:fast-talk",
        "value": {
          "raw": "40% (20/8)",
          "value": 40,
          "half": 20,
          "fifth": 8
        }
      },
      {
        "name": "Метание",
        "skill": "coc:skill:throw",
        "value": {
          "raw": "40% (20/8)",
          "value": 40,
          "half": 20,
          "fifth": 8
        }
      },
      {
        "name": "Механика",
        "skill": "coc:skill:mechanical-repair",
        "value": {
          "raw": "40% (20/8)",
          "value": 40,
          "half": 20,
          "fifth": 8
        }
      },
      {
        "name": "Ориентирование",
        "skill": "coc:skill:navigate",
        "value": {
          "raw": "40% (20/8)",
          "value": 40,
          "half": 20,
          "fifth": 8
        }
      },
      {
        "name": "Первая помощь",
        "skill": "coc:skill:first-aid",
        "value": {
          "raw": "30% (15/6)",
          "value": 30,
          "half": 15,
          "fifth": 6
        }
      },
      {
        "name": "Плавание",
        "skill": "coc:skill:swim",
        "value": {
          "raw": "30% (15/6)",
          "value": 30,
          "half": 15,
          "fifth": 6
        }
      },
      {
        "name": "Психология",
        "skill": "coc:skill:psychology",
        "value": {
          "raw": "40% (20/8)",
          "value": 40,
          "half": 20,
          "fifth": 8
        }
      },
      {
        "name": "Скрытность",
        "skill": "coc:skill:stealth",
        "value": {
          "raw": "40% (20/8)",
          "value": 40,
          "half": 20,
          "fifth": 8
        }
      },
      {
        "name": "Слух",
        "skill": "coc:skill:listen",
        "value": {
          "raw": "45% (22/9)",
          "value": 45,
          "half": 22,
          "fifth": 9
        }
      },
      {
        "name": "Средства",
        "skill": "coc:skill:credit-rating",
        "value": {
          "raw": "32% (16/6)",
          "value": 32,
          "half": 16,
          "fifth": 6
        }
      },
      {
        "name": "Стрельба (автоматический пистолет 38-го калибра)",
        "skill": "coc:skill:firearms",
        "specialization": "Пистолет",
        "value": {
          "raw": "50% (25/10)",
          "value": 50,
          "half": 25,
          "fifth": 10
        }
      },
      {
        "name": "Убеждение",
        "skill": "coc:skill:persuade",
        "value": {
          "raw": "40% (20/8)",
          "value": 40,
          "half": 20,
          "fifth": 8
        }
      },
      {
        "name": "Юриспруденция",
        "skill": "coc:skill:law",
        "value": {
          "raw": "40% (20/8)",
          "value": 40,
          "half": 20,
          "fifth": 8
        }
      }
    ]
  },
  "background": {
    "significant_people": "• Мэри Фуллер (персонаж игрока): подруга вашей сестры и опытная медсестра. Ещё она кузина Чака Огла. Вы не знаете, нравитесь ли вы ей как мужчина, но она согласилась пойти парой на вечеринку Чака.\n• Эллиот Клосон (персонаж игрока): репортёр газеты. Вы с ним виделись. Хорошо выполняет свою работу и не чинит проблем полиции.\n• Уэйд Ботелер (персонаж игрока): частный детектив без лицензии, бывший пару раз в участке по обвинению в работе без лицензии. Что он тут делает?\n• Сисси Ричардс (персонаж Хранителя): сестра. Разведена и владеет цветочным магазинчиком.\n• Чак Огл (персонаж Хранителя): кузен Мэри Фуллер. Он был смертельно болен и получил лечение от «ЗиМедБио». Теперь он проводит вечеринку. Вы хотите расспросить его насчёт «ЗиМедБио».\n• Начальник полиции Доусон (персонаж Хранителя): ваш начальник. У него был рак поджелудочной железы последней стадии, но он утверждает, что исцелился в «ЗиМедБио». Ведёт себя подозрительно, и вы не решаетесь действовать официально."
  },
  "description": {
    "ru": "Бонус: распределите 40 пунктов между любыми навыками на выбор игрока.",
    "en": null
  },
  "legend": {
    "ru": "Вы работаете в полиции уже двадцать лет. Вы не особо ладите с начальником Доусоном, но он недавно объявил об уходе на пенсию из-за неизлечимого рака, а такого и врагу не пожелаешь. Он взял больничный, а его позицию занял заместитель. Недавно вы начали расследовать нападение на парковке «ЗиМедБио», медицинской исследовательской компании. Мужчину (Эндрю Лучо) сильно изувечили — его словно покусали собаки или койоты, но также он получил глубокие резаные раны, как от ножа. Парень был не в себе, и в больнице никого к нему не пускали. В «ЗиМедБио» вы поговорили с начальником отдела безопасности Уэсли Райсом. Тот подтвердил, что охранник нашёл Лучо где-то в 22:30 и вызвал скорую. Охранник не видел нападения, произошедшего в слепой зоне камер наблюдения. Вы отложили расследование, пока Лучо не поправится и не сможет рассказать, что случилось. На прошлой неделе внезапно вернулся Доусон и сказал, что исцелился от рака и готов снова работать. Но разве от рака поджелудочной железы IV стадии излечиваются? Доусон подтвердил, что лечился в «ЗиМедБио», но уклоняется от подробностей. Вскоре он перевёл вашего напарника в отдел по борьбе с организованной преступностью, вас — на работу с документами и закрыл дело о нападении у «ЗиМедБио». Что-то здесь нечисто. Когда вы навещали сестру, её лучшая подруга Мэри Фуллер упомянула, что идёт на вечеринку к кузену Чаку, который тоже лечился в «ЗиМедБио». Вы решили, что сможете через него узнать побольше о компании (без ведома Доусона), и предложили Мэри сопровождение. Она согласилась, так что вы идёте парой.",
    "en": null
  },
  "sources": [
    {
      "book_id": "digital-nightmares-pregens-ru",
      "physical_page": 22,
      "printed_page": null,
      "method": "book_text",
      "verified": true,
      "note": "сценарий: Глава 3: Панацея"
    }
  ],
  "quality": {
    "needs_review": false,
    "flags": []
  },
  "relations": [
    {
      "type": "knows",
      "target": "digital-nightmares-ru/character/mary-fuller",
      "note": "лучшая подруга сестры; пара на вечеринке",
      "note_back": "брат лучшей подруги; пара на вечеринке"
    },
    {
      "type": "knows",
      "target": "digital-nightmares-ru/character/wade-boteler",
      "note": "частный детектив без лицензии; едва знакомы",
      "note_back": "полицейский; едва знакомы"
    }
  ]
}
