{
  "schema": "sourcefold.character.v0",
  "id": "masks-of-nyarlathotep-en/character/thomas-kinnery",
  "kind": "character",
  "name": {
    "ru": "Томас Киннери",
    "en": "Thomas Kinnery"
  },
  "roles": [
    "npc"
  ],
  "occupation": {
    "ru": "личный секретарь Гэвигана",
    "en": "Gavigan’s private secretary"
  },
  "occupation_ref": "coc:occupation:sekretar",
  "age": {
    "raw": "36",
    "value": 36
  },
  "sex": "мужской",
  "residence": "Лондон",
  "axes": {
    "era": [
      "1920s"
    ],
    "ruleset": "core"
  },
  "relations": [
    {
      "type": "works_for",
      "target": "masks-of-nyarlathotep-en/character/edward-gavigan",
      "note": "хозяин",
      "note_back": "личный секретарь"
    }
  ],
  "statblock": {
    "averages": false,
    "characteristics": {
      "STR": {
        "raw": "45",
        "value": 45
      },
      "CON": {
        "raw": "55",
        "value": 55
      },
      "SIZ": {
        "raw": "45",
        "value": 45
      },
      "DEX": {
        "raw": "80",
        "value": 80
      },
      "APP": {
        "raw": "50",
        "value": 50
      },
      "INT": {
        "raw": "70",
        "value": 70
      },
      "POW": {
        "raw": "45",
        "value": 45
      },
      "EDU": {
        "raw": "75",
        "value": 75
      }
    },
    "hp": {
      "raw": "10",
      "value": 10
    },
    "mp": {
      "raw": "9",
      "value": 9
    },
    "damage_bonus": {
      "raw": "0",
      "value": 0
    },
    "build": {
      "raw": "0",
      "value": 0
    },
    "move": {
      "raw": "8",
      "value": 8,
      "modes": [
        {
          "mode": "walk",
          "value": 8
        }
      ]
    },
    "luck": {
      "raw": "—",
      "value": null
    },
    "sanity": {
      "raw": "00",
      "value": 0
    },
    "attacks_per_round": {
      "raw": "1",
      "value": 1
    },
    "attacks": [
      {
        "name": {
          "ru": "Ближний бой (драка)",
          "en": "Brawl"
        },
        "kind": "attack",
        "skill": "Ближний бой (драка)",
        "chance": {
          "raw": "40% (20/8)",
          "value": 40,
          "half": 20,
          "fifth": 8
        },
        "damage": {
          "raw": "1d3",
          "dice": "1d3",
          "adds_db": true
        },
        "weapon": "coc:weapon:unarmed"
      },
      {
        "name": {
          "ru": "Дубинка",
          "en": "club"
        },
        "kind": "attack",
        "skill": "Ближний бой (драка)",
        "chance": {
          "raw": "40% (20/8)",
          "value": 40,
          "half": 20,
          "fifth": 8
        },
        "damage": {
          "raw": "1d6",
          "dice": "1d6",
          "adds_db": true
        },
        "weapon": "coc:weapon:club-small"
      }
    ],
    "dodge": {
      "raw": "50% (25/10)",
      "value": 50,
      "half": 25,
      "fifth": 10
    },
    "skills": [
      {
        "name": "Бухгалтерское дело",
        "skill": "coc:skill:accounting",
        "value": {
          "raw": "80%",
          "value": 80
        }
      },
      {
        "name": "Археология",
        "skill": "coc:skill:archaeology",
        "value": {
          "raw": "20%",
          "value": 20
        }
      },
      {
        "name": "Обаяние",
        "skill": "coc:skill:charm",
        "value": {
          "raw": "10%",
          "value": 10
        }
      },
      {
        "name": "Средства",
        "skill": "coc:skill:credit-rating",
        "value": {
          "raw": "40%",
          "value": 40
        }
      },
      {
        "name": "Мифы Ктулху",
        "skill": "coc:skill:cthulhu-mythos",
        "value": {
          "raw": "7%",
          "value": 7
        }
      },
      {
        "name": "Красноречие",
        "skill": "coc:skill:fast-talk",
        "value": {
          "raw": "70%",
          "value": 70
        }
      },
      {
        "name": "История (египетская)",
        "skill": "coc:skill:history",
        "specialization": "Египетская",
        "value": {
          "raw": "35%",
          "value": 35
        }
      },
      {
        "name": "Слух",
        "skill": "coc:skill:listen",
        "value": {
          "raw": "55%",
          "value": 55
        }
      },
      {
        "name": "Убеждение",
        "skill": "coc:skill:persuade",
        "value": {
          "raw": "35%",
          "value": 35
        }
      },
      {
        "name": "Психология",
        "skill": "coc:skill:psychology",
        "value": {
          "raw": "30%",
          "value": 30
        }
      },
      {
        "name": "Внимание",
        "skill": "coc:skill:spot-hidden",
        "value": {
          "raw": "40%",
          "value": 40
        }
      },
      {
        "name": "Скрытность",
        "skill": "coc:skill:stealth",
        "value": {
          "raw": "50%",
          "value": 50
        }
      },
      {
        "name": "Метание",
        "skill": "coc:skill:throw",
        "value": {
          "raw": "30%",
          "value": 30
        }
      },
      {
        "name": "Родной язык (английский)",
        "skill": "coc:skill:language-own",
        "specialization": "Английский",
        "value": {
          "raw": "75%",
          "value": 75
        }
      }
    ]
  },
  "description": {
    "ru": "Личный секретарь Эдварда Гэвигана в Фонде Пенхью, угодливый «хорёк», который ходит за хозяином как верный пёс. Мелкий, в костюме в тонкую полоску, с острым носом и угловатыми чертами; подобострастен, исполнителен и высокомерен.",
    "en": null
  },
  "legend": {
    "ru": "Глава «Англия». Ведёт ежедневник Гэвигана, назначает встречи и выставляет «бездельников»; захочет узнать, зачем сыщики добиваются приёма. Член Братства Чёрного фараона: обычно сопровождает Гэвигана на обряды в Миср-Хаусе, но не ездит с ним в Дерби; знает, что «Хенсон Мэньюфекчуринг» делает особые детали для сэра Обри, но не больше. Охотно отдаст жизнь за хозяина, но он слабое звено: на допросе может невольно выдать, когда следующий обряд в Миср-Хаусе или что Гэвиган регулярно ездит в Дерби.",
    "en": null
  },
  "sources": [
    {
      "book_id": "masks-of-nyarlathotep-en",
      "physical_page": 291,
      "printed_page": 288,
      "method": "book_text",
      "verified": true,
      "entry_page": 190,
      "note": "глава 3 «Англия»; описание — «Второстепенные персонажи», с. 187"
    }
  ],
  "quality": {
    "needs_review": false,
    "flags": [
      "translated"
    ],
    "notes": "Родной язык указан по происхождению персонажа; в книге языки даны одним списком."
  }
}
