{
  "schema": "sourcefold.character.v0",
  "id": "masks-of-nyarlathotep-en/character/mortimer-wycroft",
  "kind": "character",
  "name": {
    "ru": "Мортимер Уайкрофт",
    "en": "Mortimer Wycroft"
  },
  "roles": [
    "npc"
  ],
  "occupation": {
    "ru": "снабженец Хьюстона, торговец снаряжением",
    "en": "Supply agent for Huston"
  },
  "occupation_ref": "coc:occupation:lavochnik",
  "age": {
    "raw": "48",
    "value": 48
  },
  "sex": "мужской",
  "residence": "Канкуджери",
  "axes": {
    "era": [
      "1920s"
    ],
    "ruleset": "core"
  },
  "relations": [
    {
      "type": "works_for",
      "target": "masks-of-nyarlathotep-en/character/robert-huston",
      "note": "заказчик и хозяин",
      "note_back": "снабженец"
    }
  ],
  "statblock": {
    "averages": false,
    "characteristics": {
      "STR": {
        "raw": "50",
        "value": 50
      },
      "CON": {
        "raw": "50",
        "value": 50
      },
      "SIZ": {
        "raw": "60",
        "value": 60
      },
      "DEX": {
        "raw": "55",
        "value": 55
      },
      "APP": {
        "raw": "25",
        "value": 25
      },
      "INT": {
        "raw": "45",
        "value": 45
      },
      "POW": {
        "raw": "25",
        "value": 25
      },
      "EDU": {
        "raw": "50",
        "value": 50
      }
    },
    "hp": {
      "raw": "11",
      "value": 11
    },
    "mp": {
      "raw": "5",
      "value": 5
    },
    "damage_bonus": {
      "raw": "0",
      "value": 0
    },
    "build": {
      "raw": "0",
      "value": 0
    },
    "move": {
      "raw": "6",
      "value": 6,
      "modes": [
        {
          "mode": "walk",
          "value": 6
        }
      ]
    },
    "luck": {
      "raw": "25",
      "value": 25
    },
    "sanity": {
      "raw": "02",
      "value": 2
    },
    "attacks_per_round": {
      "raw": "1",
      "value": 1
    },
    "attacks": [
      {
        "name": {
          "ru": "Ближний бой (драка)",
          "en": "Brawl"
        },
        "kind": "attack",
        "skill": "Ближний бой (драка)",
        "chance": {
          "raw": "30% (15/6)",
          "value": 30,
          "half": 15,
          "fifth": 6
        },
        "damage": {
          "raw": "1d3",
          "dice": "1d3",
          "adds_db": false
        },
        "weapon": "coc:weapon:unarmed"
      },
      {
        "name": {
          "ru": "Дробовик двуствольный 20-го калибра",
          "en": "20-g shotgun (2B)"
        },
        "kind": "attack",
        "skill": "Стрельба (винтовка/дробовик)",
        "chance": {
          "raw": "45% (22/9)",
          "value": 45,
          "half": 22,
          "fifth": 9
        },
        "damage": {
          "raw": "2d6/1d6/1d3",
          "dice": "2d6/1d6/1d3",
          "adds_db": false
        },
        "weapon": "coc:weapon:shotgun-20-gauge-2b"
      }
    ],
    "dodge": {
      "raw": "30% (15/6)",
      "value": 30,
      "half": 15,
      "fifth": 6
    },
    "skills": [
      {
        "name": "Бухгалтерское дело",
        "skill": "coc:skill:accounting",
        "value": {
          "raw": "25%",
          "value": 25
        }
      },
      {
        "name": "Лазание",
        "skill": "coc:skill:climb",
        "value": {
          "raw": "20%",
          "value": 20
        }
      },
      {
        "name": "Средства",
        "skill": "coc:skill:credit-rating",
        "value": {
          "raw": "15%",
          "value": 15
        }
      },
      {
        "name": "Мифы Ктулху",
        "skill": "coc:skill:cthulhu-mythos",
        "value": {
          "raw": "6%",
          "value": 6
        }
      },
      {
        "name": "Вождение автомобиля",
        "skill": "coc:skill:drive-auto",
        "value": {
          "raw": "30%",
          "value": 30
        }
      },
      {
        "name": "Электрика",
        "skill": "coc:skill:electrical-repair",
        "value": {
          "raw": "15%",
          "value": 15
        }
      },
      {
        "name": "Прыжки",
        "skill": "coc:skill:jump",
        "value": {
          "raw": "25%",
          "value": 25
        }
      },
      {
        "name": "Слух",
        "skill": "coc:skill:listen",
        "value": {
          "raw": "40%",
          "value": 40
        }
      },
      {
        "name": "Управление тяжёлыми машинами",
        "skill": "coc:skill:heavy-machinery",
        "value": {
          "raw": "20%",
          "value": 20
        }
      },
      {
        "name": "Психология",
        "skill": "coc:skill:psychology",
        "value": {
          "raw": "25%",
          "value": 25
        }
      },
      {
        "name": "Внимание",
        "skill": "coc:skill:spot-hidden",
        "value": {
          "raw": "40%",
          "value": 40
        }
      },
      {
        "name": "Скрытность",
        "skill": "coc:skill:stealth",
        "value": {
          "raw": "20%",
          "value": 20
        }
      },
      {
        "name": "Выживание (пустыня)",
        "skill": "coc:skill:survival",
        "specialization": "пустыня",
        "value": {
          "raw": "30%",
          "value": 30
        }
      },
      {
        "name": "Метание",
        "skill": "coc:skill:throw",
        "value": {
          "raw": "25%",
          "value": 25
        }
      },
      {
        "name": "Иностранный язык (австралийский аборигенный английский)",
        "skill": "coc:skill:language-other",
        "specialization": "австралийский аборигенный английский",
        "value": {
          "raw": "30%",
          "value": 30
        }
      },
      {
        "name": "Родной язык (английский)",
        "skill": "coc:skill:language-own",
        "specialization": "английский",
        "value": {
          "raw": "50%",
          "value": 50
        }
      }
    ]
  },
  "description": {
    "ru": "Аборигены прозвали его «Мертвецом» (Deadfella Man): кожа белая, как брюхо ящерицы, глаза запавшие, тело как скелет. Разум полностью разрушен — он едва сознаёт, что существует, — так что проверка Психологии почти не нужна. Скорее спрячется, чем будет драться, если только не угрожают его драгоценной книге. За прилавком держит дробовик и на ночь уносит его к себе.",
    "en": null
  },
  "legend": {
    "ru": "Скорее агент культа, чем культист: держит лавку снаряжения на окраине Канкуджери с тремя дочерьми и неделями возит грузовиками припасы Хьюстону к городу Великой Расы, к которому питает нездоровую любовь; мечтает обменяться разумом с йитианином, но слишком жалок, чтобы их заинтересовать. Посвящён в культ, но не татуирован — рисует знак летучей мыши чёрным гримом. Под кроватью хранит первое издание «Чудесных сведений» Джеймса Вудвилла о Великой Расе; Уайкрофты одержимо преследуют и пытаются убить любого, кто её украдёт. Узнав о планах сыщиков, может предложить взять их с собой «на доставку к прииску», чтобы по дороге захватить и выслужиться перед Хьюстоном.",
    "en": null
  },
  "sources": [
    {
      "book_id": "masks-of-nyarlathotep-en",
      "physical_page": 515,
      "printed_page": 512,
      "method": "book_text",
      "verified": true,
      "entry_page": 461,
      "note": "Глава 6 «Австралия», раздел «Персонажи и чудовища: Австралия»"
    }
  ],
  "quality": {
    "needs_review": false,
    "flags": [
      "translated"
    ],
    "notes": "Родной язык (английский) определён по происхождению персонажа: в книге языки перечислены без пометки родного."
  }
}
