{
  "schema": "sourcefold.character.v0",
  "id": "pobeg-iz-innsmuta-ru/character/dzheykob-marsh",
  "kind": "character",
  "name": {
    "ru": "Джейкоб Марш",
    "en": null
  },
  "roles": [
    "npc"
  ],
  "occupation": {
    "ru": "управляющий заводом",
    "en": null
  },
  "occupation_ref": "coc:occupation:menedzher-srednego-ili-vysshego-zvena",
  "age": {
    "raw": "27",
    "value": 27
  },
  "sex": "мужской",
  "residence": "Иннсмут",
  "axes": {
    "era": [
      "1920s"
    ],
    "ruleset": "core"
  },
  "relations": [
    {
      "type": "relative_of",
      "target": "pobeg-iz-innsmuta-ru/character/sebastyan-marsh",
      "note": "отец",
      "note_back": "сын"
    }
  ],
  "statblock": {
    "averages": false,
    "characteristics": {
      "STR": {
        "raw": "50",
        "value": 50
      },
      "CON": {
        "raw": "65",
        "value": 65
      },
      "SIZ": {
        "raw": "55",
        "value": 55
      },
      "DEX": {
        "raw": "65",
        "value": 65
      },
      "APP": {
        "raw": "45",
        "value": 45
      },
      "INT": {
        "raw": "65",
        "value": 65
      },
      "POW": {
        "raw": "65",
        "value": 65
      },
      "EDU": {
        "raw": "60",
        "value": 60
      }
    },
    "hp": {
      "raw": "12",
      "value": 12
    },
    "mp": {
      "raw": "14",
      "value": 14
    },
    "damage_bonus": {
      "raw": "0",
      "value": 0
    },
    "build": {
      "raw": "0",
      "value": 0
    },
    "move": {
      "raw": "7",
      "value": 7,
      "modes": [
        {
          "mode": "walk",
          "value": 7
        }
      ]
    },
    "sanity": {
      "raw": "00",
      "value": 0
    },
    "skills": [
      {
        "name": "Бухгалтерское дело",
        "skill": "coc:skill:accounting",
        "value": {
          "raw": "65%",
          "value": 65,
          "half": 32,
          "fifth": 13
        }
      },
      {
        "name": "Торговля",
        "value": {
          "raw": "65%",
          "value": 65,
          "half": 32,
          "fifth": 13
        }
      },
      {
        "name": "Наука (Химия)",
        "skill": "coc:skill:science",
        "specialization": "Химия",
        "value": {
          "raw": "20%",
          "value": 20,
          "half": 10,
          "fifth": 4
        }
      },
      {
        "name": "Средства",
        "skill": "coc:skill:credit-rating",
        "value": {
          "raw": "55%",
          "value": 55,
          "half": 27,
          "fifth": 11
        }
      },
      {
        "name": "Мифы Ктулху",
        "skill": "coc:skill:cthulhu-mythos",
        "value": {
          "raw": "30%",
          "value": 30,
          "half": 15,
          "fifth": 6
        }
      },
      {
        "name": "Управление производством",
        "value": {
          "raw": "55%",
          "value": 55,
          "half": 27,
          "fifth": 11
        }
      },
      {
        "name": "Красноречие",
        "skill": "coc:skill:fast-talk",
        "value": {
          "raw": "80%",
          "value": 80,
          "half": 40,
          "fifth": 16
        }
      },
      {
        "name": "Наука (Геология)",
        "skill": "coc:skill:science",
        "specialization": "Геология",
        "value": {
          "raw": "45%",
          "value": 45,
          "half": 22,
          "fifth": 9
        }
      },
      {
        "name": "Механика",
        "skill": "coc:skill:mechanical-repair",
        "value": {
          "raw": "30%",
          "value": 30,
          "half": 15,
          "fifth": 6
        }
      },
      {
        "name": "Психология",
        "skill": "coc:skill:psychology",
        "value": {
          "raw": "55%",
          "value": 55,
          "half": 27,
          "fifth": 11
        }
      },
      {
        "name": "Внимание",
        "skill": "coc:skill:spot-hidden",
        "value": {
          "raw": "45%",
          "value": 45,
          "half": 22,
          "fifth": 9
        }
      }
    ]
  },
  "description": {
    "ru": "Невысокий молодой человек 27 лет с зачёсанными назад волосами, слишком широкой улыбкой и слегка навыкате глазами; скользкий, но дружелюбный.",
    "en": null
  },
  "legend": {
    "ru": "Сын Себастьяна Марша, управляющий конторой Аффинажной компании Марша. Источает обаяние всякий раз, когда нужно прикрыть скудную, почти отсутствующую бухгалтерию завода: на расспросы объясняет расхождения между закупленной рудой и выпущенным золотом высокой эффективностью производства. Его любовница — регистратор Люси Джеймс. Тех, кто досаждает ему без причины, вскоре навещают констебли.",
    "en": null
  },
  "sources": [
    {
      "book_id": "pobeg-iz-innsmuta-ru",
      "physical_page": 49,
      "printed_page": 49,
      "method": "book_text",
      "verified": true,
      "entry_page": 48,
      "note": "Блок характеристик и навыки."
    }
  ],
  "errata": [
    {
      "field": "statblock.mp",
      "printed": "14",
      "expected": "13",
      "note": "ПМ = МОЩ/5 = 65/5 = 13; оставлено как напечатано."
    }
  ],
  "quality": {
    "needs_review": false,
    "flags": [],
    "notes": "Боевых параметров в блоке нет. «Торговля», «Управление производством» нет в справочнике навыков. Рассудок 00 — как напечатано."
  }
}
