{
  "schema": "sourcefold.character.v0",
  "id": "za-zakrytymi-dveryami-ru/character/john-brown",
  "kind": "character",
  "name": {
    "ru": "Джон Браун",
    "en": null
  },
  "roles": [
    "pregen"
  ],
  "player_chooses": [
    "luck"
  ],
  "occupation": {
    "ru": "Механик",
    "en": null
  },
  "occupation_ref": "coc:occupation:tekhnik-master",
  "age": {
    "raw": "26",
    "value": 26
  },
  "sex": "мужской",
  "residence": "всюду и нигде",
  "birthplace": "Чикаго, США",
  "axes": {
    "era": [
      "1920s"
    ],
    "ruleset": "core"
  },
  "statblock": {
    "averages": false,
    "characteristics": {
      "STR": {
        "raw": "70 (35/14)",
        "value": 70
      },
      "CON": {
        "raw": "60 (30/12)",
        "value": 60
      },
      "SIZ": {
        "raw": "55 (27/11)",
        "value": 55
      },
      "DEX": {
        "raw": "70 (35/14)",
        "value": 70
      },
      "INT": {
        "raw": "65 (32/13)",
        "value": 65
      },
      "APP": {
        "raw": "60 (30/12)",
        "value": 60
      },
      "POW": {
        "raw": "70 (35/14)",
        "value": 70
      },
      "EDU": {
        "raw": "70 (35/14)",
        "value": 70
      }
    },
    "hp": {
      "raw": "11",
      "value": 11
    },
    "mp": {
      "raw": "14",
      "value": 14
    },
    "sanity": {
      "raw": "70",
      "value": 70,
      "max": null
    },
    "damage_bonus": {
      "raw": "+1d4",
      "value": "+1d4"
    },
    "build": {
      "raw": "+1",
      "value": 1
    },
    "move": {
      "raw": "9",
      "value": 9,
      "modes": [
        {
          "mode": "walk",
          "value": 9
        }
      ]
    },
    "attacks": [
      {
        "name": {
          "ru": "Без оружия",
          "en": null
        },
        "kind": "attack",
        "skill": "Ближний бой (драка)",
        "chance": {
          "raw": "50/25/10",
          "value": 50,
          "half": 25,
          "fifth": 10
        },
        "damage": {
          "raw": "1d3 + БкУ",
          "dice": "1d3",
          "adds_db": true
        },
        "weapon": "coc:weapon:unarmed",
        "notes": "Дальн. —; атаки 1; патроны —; неиспр. —"
      },
      {
        "name": {
          "ru": "Разводной ключ",
          "en": null
        },
        "kind": "attack",
        "skill": "Ближний бой (драка)",
        "chance": {
          "raw": "50/25/10",
          "value": 50,
          "half": 25,
          "fifth": 10
        },
        "damage": {
          "raw": "1d8 + БкУ",
          "dice": "1d8",
          "adds_db": true
        },
        "weapon": "coc:weapon:club-large",
        "notes": "Дальн. —; атаки 1; патроны —; неиспр. —"
      }
    ],
    "dodge": {
      "raw": "35 (17/7)",
      "value": 35,
      "half": 17,
      "fifth": 7
    },
    "skills": [
      {
        "name": "Ближний бой (драка)",
        "skill": "coc:skill:fighting",
        "specialization": "Драка",
        "value": {
          "raw": "50 (25/10)",
          "value": 50,
          "half": 25,
          "fifth": 10
        }
      },
      {
        "name": "Внимание",
        "skill": "coc:skill:spot-hidden",
        "value": {
          "raw": "55 (27/11)",
          "value": 55,
          "half": 27,
          "fifth": 11
        }
      },
      {
        "name": "Вождение",
        "skill": "coc:skill:drive-auto",
        "value": {
          "raw": "50 (25/10)",
          "value": 50,
          "half": 25,
          "fifth": 10
        }
      },
      {
        "name": "Ис-во/ремесло (Сварка)",
        "skill": "coc:skill:art-craft",
        "specialization": "Сварка",
        "value": {
          "raw": "55 (27/11)",
          "value": 55,
          "half": 27,
          "fifth": 11
        }
      },
      {
        "name": "Лазание",
        "skill": "coc:skill:climb",
        "value": {
          "raw": "40 (20/8)",
          "value": 40,
          "half": 20,
          "fifth": 8
        }
      },
      {
        "name": "Метание",
        "skill": "coc:skill:throw",
        "value": {
          "raw": "40 (20/8)",
          "value": 40,
          "half": 20,
          "fifth": 8
        }
      },
      {
        "name": "Механика",
        "skill": "coc:skill:mechanical-repair",
        "value": {
          "raw": "60 (30/12)",
          "value": 60,
          "half": 30,
          "fifth": 12
        }
      },
      {
        "name": "Перв. помощь",
        "skill": "coc:skill:first-aid",
        "value": {
          "raw": "50 (25/10)",
          "value": 50,
          "half": 25,
          "fifth": 10
        }
      },
      {
        "name": "Прыжки",
        "skill": "coc:skill:jump",
        "value": {
          "raw": "20 (10/4)",
          "value": 20,
          "half": 10,
          "fifth": 4
        }
      },
      {
        "name": "Психология",
        "skill": "coc:skill:psychology",
        "value": {
          "raw": "40 (20/8)",
          "value": 40,
          "half": 20,
          "fifth": 8
        }
      },
      {
        "name": "Скрытность",
        "skill": "coc:skill:stealth",
        "value": {
          "raw": "20 (10/4)",
          "value": 20,
          "half": 10,
          "fifth": 4
        }
      },
      {
        "name": "Слух",
        "skill": "coc:skill:listen",
        "value": {
          "raw": "20 (10/4)",
          "value": 20,
          "half": 10,
          "fifth": 4
        }
      },
      {
        "name": "Средства",
        "skill": "coc:skill:credit-rating",
        "value": {
          "raw": "30 (15/6)",
          "value": 30,
          "half": 15,
          "fifth": 6
        }
      },
      {
        "name": "Стрельба (пистолет)",
        "skill": "coc:skill:firearms",
        "specialization": "Пистолет",
        "value": {
          "raw": "20 (10/4)",
          "value": 20,
          "half": 10,
          "fifth": 4
        }
      },
      {
        "name": "Убеждение",
        "skill": "coc:skill:persuade",
        "value": {
          "raw": "60 (30/12)",
          "value": 60,
          "half": 30,
          "fifth": 12
        }
      },
      {
        "name": "Управление тяжёлыми машинами",
        "skill": "coc:skill:heavy-machinery",
        "value": {
          "raw": "30 (15/6)",
          "value": 30,
          "half": 15,
          "fifth": 6
        }
      },
      {
        "name": "Электрика",
        "skill": "coc:skill:electrical-repair",
        "value": {
          "raw": "60 (30/12)",
          "value": 60,
          "half": 30,
          "fifth": 12
        }
      },
      {
        "name": "Язык, родной (Английский)",
        "skill": "coc:skill:language-own",
        "specialization": "Английский",
        "value": {
          "raw": "70 (35/14)",
          "value": 70,
          "half": 35,
          "fifth": 14
        }
      }
    ]
  },
  "background": {
    "description": "Невысок, как и его сестра Иделла. Когда не носит кобминезон механика, одевается с иголочки, но всегда надевает кепку-«аэродром», которую считает своим талисманом ещё с поездки во Францию.",
    "traits": "Практичный, рассудительный и терпеливый",
    "significant_people": "Сестра Иделла. Порой она слишком любит командовать и рисковать, но сердце у неё доброе.",
    "treasured_possessions": "Кепка-«аэродром», которая приносит удачу."
  },
  "possessions": [
    "Инструменты механика",
    "Комбинезон",
    "Фонарик"
  ],
  "wealth": {
    "spending_level": "$10",
    "cash": "$60",
    "assets": "$1,500"
  },
  "legend": {
    "ru": "Джон Браун — спокойный молодой человек, который оттеняет бурную натуру своей старшей сестры Иделлы. Она родилась раньше на каких-то 15 минут, но неизменно вела себя так, словно разница в возрасте составляет несколько лет.\nУ Джона золотые руки, своё призвание он с ранних лет видел в механике и был приятно удивлён, хотя и несколько смущён, когда семья накопила денег, чтобы отправить его в колледж получать образование. Тогда он впервые расстался с Иделлой, и разлука не пришлась ему по душе.\nОн понимал, почему семья решила переехать из Чикаго, что повлекло за собой целый ворох проблем, но на новом месте, в деревне Роббинс, Джону не хватало городских огней. Они с Иделлой переехали назад в старый район, упорно работали и старались избегать неприятностей. Он научил сестру всему, что знал о машинах, и с удовольствием работал с ней плечом к плечу, когда босс бывал в отъезде.\nНо тут Иделле взбрело в голову отправиться во Францию и выучиться на пилота. Джон всё ещё чувствовал вину за то, что получал образование без неё, и верил, что Иделла сможет добиться своего, а потому помог ей скопить денег на билет и, поскольку оба не хотели вновь оказаться порознь, согласился поехать с ней.\nДжону трудно в этом признаться, но, уехав из Чикаго, он понял, что это было верным решением. Работая механиком при самолёте сестры, он побывал во многих интересных местах, хоть и не переставал переживать за неё во время исполнения трюков. Что важнее всего, он гордится достижениями Иделлы и тем, какой сплочённой командой они стали.",
    "en": null
  },
  "sources": [
    {
      "book_id": "za-zakrytymi-dveryami-pregens-ru",
      "physical_page": 7,
      "printed_page": null,
      "method": "book_text",
      "verified": true
    },
    {
      "book_id": "za-zakrytymi-dveryami-pregens-ru",
      "physical_page": 8,
      "printed_page": null,
      "method": "book_text",
      "verified": true
    },
    {
      "book_id": "za-zakrytymi-dveryami-pregens-ru",
      "physical_page": 9,
      "printed_page": null,
      "method": "book_text",
      "verified": true
    }
  ],
  "quality": {
    "needs_review": false,
    "flags": [],
    "notes": "Числа сняты с изображений листа сыщика. Удача на листе не отмечена — игрок бросает её сам. Строка «Пилотирование (Воздушное судно)» на листе подписана, но значение не проставлено — в записи её нет. Урон разводного ключа в листе — «1d8 + db»."
  }
}
