{
  "schema": "sourcefold.character.v0",
  "id": "dveri-vo-tmu-ru/character/jacob-gibson",
  "kind": "character",
  "name": {
    "ru": "Джейкоб Гибсон",
    "en": null
  },
  "roles": [
    "pregen"
  ],
  "occupation": {
    "ru": "завхоз",
    "en": null
  },
  "age": {
    "raw": "36 лет",
    "value": 36
  },
  "sex": "мужской",
  "axes": {
    "era": [
      "1920s"
    ],
    "ruleset": "core"
  },
  "statblock": {
    "averages": false,
    "characteristics": {
      "STR": {
        "raw": "70",
        "value": 70
      },
      "CON": {
        "raw": "65",
        "value": 65
      },
      "SIZ": {
        "raw": "65",
        "value": 65
      },
      "DEX": {
        "raw": "45",
        "value": 45
      },
      "INT": {
        "raw": "50",
        "value": 50
      },
      "APP": {
        "raw": "55",
        "value": 55
      },
      "POW": {
        "raw": "70",
        "value": 70
      },
      "EDU": {
        "raw": "70",
        "value": 70
      }
    },
    "hp": {
      "raw": "13",
      "value": 13
    },
    "mp": {
      "raw": "14",
      "value": 14
    },
    "sanity": {
      "raw": "70",
      "value": 70,
      "max": null
    },
    "luck": {
      "raw": "60",
      "value": 60
    },
    "damage_bonus": {
      "raw": "+1d4",
      "value": "+1d4"
    },
    "build": {
      "raw": "1",
      "value": 1
    },
    "move": {
      "raw": "8",
      "value": 8,
      "modes": [
        {
          "mode": "walk",
          "value": 8
        }
      ]
    },
    "attacks": [
      {
        "name": {
          "ru": "Ближний бой (драка)",
          "en": null
        },
        "kind": "attack",
        "skill": "Ближний бой (драка)",
        "chance": {
          "raw": "60% (30/12)",
          "value": 60,
          "half": 30,
          "fifth": 12
        },
        "damage": {
          "raw": "1d3 + 1d4",
          "dice": "1d3",
          "adds_db": true
        }
      },
      {
        "name": {
          "ru": "Ближний бой (гаечный ключ)",
          "en": null
        },
        "kind": "attack",
        "skill": "Ближний бой (драка)",
        "chance": {
          "raw": "60% (30/12)",
          "value": 60,
          "half": 30,
          "fifth": 12
        },
        "damage": {
          "raw": "1d8 + 1d4",
          "dice": "1d8",
          "adds_db": true
        }
      }
    ],
    "dodge": {
      "raw": "45% (22/9)",
      "value": 45,
      "half": 22,
      "fifth": 9
    },
    "skills": [
      {
        "name": "Ближний бой (драка)",
        "skill": "coc:skill:fighting",
        "specialization": "Драка",
        "value": {
          "raw": "60% (30/12)",
          "value": 60,
          "half": 30,
          "fifth": 12
        }
      },
      {
        "name": "Взлом",
        "skill": "coc:skill:locksmith",
        "value": {
          "raw": "40% (20/8)",
          "value": 40,
          "half": 20,
          "fifth": 8
        }
      },
      {
        "name": "Внимание",
        "skill": "coc:skill:spot-hidden",
        "value": {
          "raw": "45% (22/9)",
          "value": 45,
          "half": 22,
          "fifth": 9
        }
      },
      {
        "name": "Вождение автомобиля",
        "skill": "coc:skill:drive-auto",
        "value": {
          "raw": "40% (20/8)",
          "value": 40,
          "half": 20,
          "fifth": 8
        }
      },
      {
        "name": "Лазание",
        "skill": "coc:skill:climb",
        "value": {
          "raw": "40% (20/8)",
          "value": 40,
          "half": 20,
          "fifth": 8
        }
      },
      {
        "name": "Механика",
        "skill": "coc:skill:mechanical-repair",
        "value": {
          "raw": "70% (35/14)",
          "value": 70,
          "half": 35,
          "fifth": 14
        }
      },
      {
        "name": "Обаяние",
        "skill": "coc:skill:charm",
        "value": {
          "raw": "40% (20/8)",
          "value": 40,
          "half": 20,
          "fifth": 8
        }
      },
      {
        "name": "Скрытность",
        "skill": "coc:skill:stealth",
        "value": {
          "raw": "50% (25/10)",
          "value": 50,
          "half": 25,
          "fifth": 10
        }
      },
      {
        "name": "Слух",
        "skill": "coc:skill:listen",
        "value": {
          "raw": "35% (17/7)",
          "value": 35,
          "half": 17,
          "fifth": 7
        }
      },
      {
        "name": "Средства",
        "skill": "coc:skill:credit-rating",
        "value": {
          "raw": "15% (7/3)",
          "value": 15,
          "half": 7,
          "fifth": 3
        }
      },
      {
        "name": "Управление тяжёлыми машинами",
        "skill": "coc:skill:heavy-machinery",
        "value": {
          "raw": "39% (19/7)",
          "value": 39,
          "half": 19,
          "fifth": 7
        }
      },
      {
        "name": "Электрика",
        "skill": "coc:skill:electrical-repair",
        "value": {
          "raw": "50% (25/10)",
          "value": 50,
          "half": 25,
          "fifth": 10
        }
      }
    ]
  },
  "background": {
    "description": "родом из Китая, среднего роста, стройный, темноволосый. Благодаря многолетнему труду очень силён и крепок, хотя и не выглядит атлетично. Руки у него грубые, мозолистые и испещрены царапинами и шрамами.",
    "traits": "от природы тих и неприметен. Не любит претенциозных людей, считающих себя лучше других.",
    "ideology": "сам живи и другим не мешай."
  },
  "possessions": [
    "Ящик инструментов",
    "рабочий комбинезон",
    "пачка сигарет",
    "зажигалка",
    "10 долларов наличными"
  ],
  "wealth": {
    "spending_level": null,
    "cash": "10 долларов наличными",
    "assets": null
  },
  "legend": {
    "ru": "Джейкоб — уборщик и завхоз университета. Он разбирается в ремонте и поддержании порядка, у него есть опыт работы с техникой, и при любом давлении он умеет сохранить хладнокровие. Друзья и знакомые часто зовут его на помощь, когда нужны «золотые руки», в том числе для взлома и тайного проникновения. Джейкоб выручил из неловкой ситуации многих преподавателей и студентов.",
    "en": null
  },
  "sources": [
    {
      "book_id": "dveri-vo-tmu-pregens-ru",
      "physical_page": 5,
      "printed_page": null,
      "method": "book_text",
      "verified": true
    }
  ],
  "quality": {
    "needs_review": false,
    "flags": [],
    "notes": "Лист из «Двери во тьму. Готовые сыщики»; пункты предыстории, оставленные в книге пустыми («часть пунктов пропущена, чтобы вы сами придали сыщику индивидуальность»), не заполнены. Родной язык в листе не указан."
  }
}
