{
  "schema": "sourcefold.character.v0",
  "id": "coc:character:herb-alachuck",
  "kind": "character",
  "name": {
    "ru": "Херб Алачак",
    "en": "Herb Alachuck"
  },
  "roles": [
    "npc"
  ],
  "stock_type": "бармен",
  "occupation": {
    "ru": "Бармен",
    "en": "Bartender"
  },
  "occupation_ref": "coc:occupation:barmen",
  "age": {
    "raw": "32",
    "value": 32
  },
  "sex": "мужской",
  "axes": {
    "era": [
      "1920s"
    ],
    "ruleset": "core"
  },
  "statblock": {
    "averages": false,
    "characteristics": {
      "STR": {
        "raw": "65",
        "value": 65
      },
      "CON": {
        "raw": "70",
        "value": 70
      },
      "SIZ": {
        "raw": "75",
        "value": 75
      },
      "DEX": {
        "raw": "55",
        "value": 55
      },
      "APP": {
        "raw": "85",
        "value": 85
      },
      "INT": {
        "raw": "60",
        "value": 60
      },
      "POW": {
        "raw": "45",
        "value": 45
      },
      "EDU": {
        "raw": "60",
        "value": 60
      }
    },
    "hp": {
      "raw": "14",
      "value": 14
    },
    "sanity": {
      "raw": "45",
      "value": 45
    },
    "luck": {
      "raw": "50",
      "value": 50
    },
    "damage_bonus": {
      "raw": "+1d4",
      "value": "+1d4"
    },
    "build": {
      "raw": "1",
      "value": 1
    },
    "move": {
      "raw": "7",
      "value": 7,
      "modes": [
        {
          "mode": "walk",
          "value": 7
        }
      ]
    },
    "attacks": [
      {
        "name": {
          "ru": "Ближний бой (драка)",
          "en": "Brawl"
        },
        "kind": "attack",
        "skill": "Ближний бой (драка)",
        "chance": {
          "raw": "70 (35/14)",
          "value": 70,
          "half": 35,
          "fifth": 14
        },
        "damage": {
          "raw": "1d3",
          "dice": "1d3",
          "adds_db": true
        },
        "weapon": "coc:weapon:unarmed"
      }
    ],
    "dodge": {
      "raw": "30 (15/6)",
      "value": 30,
      "half": 15,
      "fifth": 6
    },
    "skills": [
      {
        "name": "Бухгалтерское дело",
        "skill": "coc:skill:accounting",
        "value": {
          "raw": "40 (20/8)",
          "value": 40,
          "half": 20,
          "fifth": 8
        }
      },
      {
        "name": "Оценка",
        "skill": "coc:skill:appraise",
        "value": {
          "raw": "20 (10/4)",
          "value": 20,
          "half": 10,
          "fifth": 4
        }
      },
      {
        "name": "Обаяние",
        "skill": "coc:skill:charm",
        "value": {
          "raw": "75 (37/15)",
          "value": 75,
          "half": 37,
          "fifth": 15
        }
      },
      {
        "name": "Средства",
        "skill": "coc:skill:credit-rating",
        "value": {
          "raw": "25 (12/5)",
          "value": 25,
          "half": 12,
          "fifth": 5
        }
      },
      {
        "name": "Первая помощь",
        "skill": "coc:skill:first-aid",
        "value": {
          "raw": "40 (20/8)",
          "value": 40,
          "half": 20,
          "fifth": 8
        }
      },
      {
        "name": "Запугивание",
        "skill": "coc:skill:intimidate",
        "value": {
          "raw": "55 (27/11)",
          "value": 55,
          "half": 27,
          "fifth": 11
        }
      },
      {
        "name": "Родной язык (английский)",
        "skill": "coc:skill:language-own",
        "specialization": "английский",
        "value": {
          "raw": "70 (35/14)",
          "value": 70,
          "half": 35,
          "fifth": 14
        }
      },
      {
        "name": "Юриспруденция",
        "skill": "coc:skill:law",
        "value": {
          "raw": "15 (7/3)",
          "value": 15,
          "half": 7,
          "fifth": 3
        }
      },
      {
        "name": "Слух",
        "skill": "coc:skill:listen",
        "value": {
          "raw": "70 (35/14)",
          "value": 70,
          "half": 35,
          "fifth": 14
        }
      },
      {
        "name": "Механика",
        "skill": "coc:skill:mechanical-repair",
        "value": {
          "raw": "50 (25/10)",
          "value": 50,
          "half": 25,
          "fifth": 10
        }
      },
      {
        "name": "Оккультизм",
        "skill": "coc:skill:occult",
        "value": {
          "raw": "25 (12/5)",
          "value": 25,
          "half": 12,
          "fifth": 5
        }
      },
      {
        "name": "Психология",
        "skill": "coc:skill:psychology",
        "value": {
          "raw": "55 (27/11)",
          "value": 55,
          "half": 27,
          "fifth": 11
        }
      },
      {
        "name": "Чтение по губам",
        "skill": "coc:skill:read-lips",
        "value": {
          "raw": "36 (18/7)",
          "value": 36,
          "half": 18,
          "fifth": 7
        }
      },
      {
        "name": "Ловкость рук",
        "skill": "coc:skill:sleight-of-hand",
        "value": {
          "raw": "60 (30/12)",
          "value": 60,
          "half": 30,
          "fifth": 12
        }
      },
      {
        "name": "Внимание",
        "skill": "coc:skill:spot-hidden",
        "value": {
          "raw": "60 (30/12)",
          "value": 60,
          "half": 30,
          "fifth": 12
        }
      }
    ]
  },
  "background": {
    "description": "Статный, мускулистый, с детским лицом.",
    "ideology": "Каждому есть что рассказать, и каждого нужно выслушать.",
    "significant_people": "Джуди, младшая сестрёнка, которую он вечно вытаскивает из неприятностей.",
    "treasured_possessions": "Счастливый образок святого Христофора — без него он не отправляется в дорогу.",
    "traits": "Не жалеет своего времени для других.",
    "secret": "Мечтает чего-то добиться в жизни и навсегда оставить работу за стойкой."
  },
  "sources": [
    {
      "book_id": "curious-characters-deck-en",
      "physical_page": 11,
      "printed_page": null,
      "method": "book_text",
      "verified": true
    }
  ],
  "errata": [
    {
      "field": "statblock.attacks[Ближний бой (драка)].damage",
      "printed": "1d3",
      "expected": "1d3+1d4",
      "note": "опечатка карточки: при БкУ +1d4 урон драки напечатан без бонуса к урону; в записи оставлено как напечатано (бонус к урону прибавляется по правилам)"
    }
  ],
  "quality": {
    "needs_review": false,
    "flags": [
      "translated",
      "parse_uncertain"
    ],
    "notes": null
  }
}
